{
  "schema": "trecap_phase2_de1soc_avalon_csr_adapter_v1",
  "file_class": "[1] hand-written Step-5 interface contract",
  "project": "T_RECAP_Phase2",
  "board": "de1soc",
  "contract_stage": "step5_avalon_mm_csr_adapter_source_implemented",
  "status": "source_implemented_and_board_source_connected_pending_generation_compile_and_hardware_evidence",
  "source_freeze": {
    "scope": "raw_adapter_rtl_source_only",
    "rtl_file": "rtl/hps_bridge/trecap_avmm_csr_adapter.sv",
    "raw_sha256": "ba096b8203fafae8099e830506c14f4eead8f95c6c0667ebd422e998de9fe40c",
    "hash_algorithm": "sha256_raw_file_bytes",
    "source_implemented": true,
    "platform_designer_connected": true,
    "functional_verification_complete": false,
    "hardware_signoff": false
  },
  "address_contract": {
    "address_unit": "byte",
    "avalon_address_width_bits": 21,
    "lightweight_aperture_span_bytes": 2097152,
    "csr_base_offset_bytes": 0,
    "csr_window_span_bytes": 4096,
    "csr_leaf_byte_address_width_bits": 12,
    "forwarded_leaf_address_bits": "avs_address_i[11:0]",
    "all_avalon_address_bits_decoded": true,
    "full_decode_required": true,
    "accepted_offset_range": "[0x000000,0x001000)",
    "unused_aperture_policy": "decode_error_no_csr_aliasing"
  },
  "transfer_contract": {
    "data_width_bits": 32,
    "byte_order": "little_endian",
    "alignment_bytes": 4,
    "read_byteenable_required": "0xf",
    "write_byteenable_required": "0xf",
    "burstcount_width_bits": 1,
    "burstcount_required": 1,
    "read_write_mutually_exclusive": true,
    "maximum_outstanding_transactions": 1,
    "request_fields_stable_while_waitrequest": true,
    "waitrequest_asserted_during_reset": true,
    "waitrequest_asserted_while_busy": true,
    "response_never_in_acceptance_cycle": true,
    "local_rejects_forwarded_to_leaf": false
  },
  "response_contract": {
    "shared_response_width_bits": 2,
    "codes": {
      "okay": 0,
      "slave_error": 2,
      "decode_error": 3
    },
    "out_of_window_response": "decode_error",
    "misaligned_response": "slave_error",
    "partial_byteenable_response": "slave_error",
    "unsupported_burst_response": "slave_error",
    "leaf_error_response": "slave_error",
    "missing_read_valid_response": "slave_error",
    "read_error_data": "0x00000000",
    "write_response_required_for_every_accepted_write": true,
    "read_response_required_for_every_accepted_read": true,
    "read_and_write_response_valid_mutually_exclusive": true,
    "illegal_simultaneous_read_write_policy": "read_priority_single_read_response_address_classification_still_applies",
    "illegal_simultaneous_read_write_forwarded_to_leaf": false
  },
  "csr_leaf_contract": {
    "request_interface": "private_valid_ready_request",
    "request_held_until_ready": true,
    "request_fields_stable_until_ready": true,
    "result_latency_cycles_after_acceptance": 1,
    "read_success_requires_rvalid": true,
    "write_success_requires_no_error": true,
    "leaf_error_maps_to": "slave_error",
    "local_reject_pulse_scope": "pre_leaf_adapter_rejects_only",
    "local_reject_counting_path": "dedicated_csr_bank_input_no_leaf_double_count",
    "leaf_command_reject_accounting_owner": "rtl/hps_bridge/trecap_csr_bank.sv"
  },
  "integration": {
    "adapter_rtl": "rtl/hps_bridge/trecap_avmm_csr_adapter.sv",
    "csr_leaf_rtl": "rtl/hps_bridge/trecap_csr_bank.sv",
    "adapter_owner": "rtl/hps_bridge/trecap_hps_bridge_top.sv",
    "logical_top": "rtl/top/trecap_de1soc_full_top.sv",
    "board_top": "rtl/platform/de1soc/de1_soc_trecap_top.sv",
    "board_top_current_state": "platform_designer_wrapper_source_connected",
    "current_hps_export": "trecap_csr_bridge.m0",
    "current_hps_export_protocol": "avalon_mm_after_qsys_axi_to_avalon_adaptation",
    "required_pending_platform_graph": "quartus_normalized_generated_interconnect_evidence",
    "required_platform_wrapper_source": "rtl/platform/de1soc/platform_designer_wrapper.sv",
    "required_pending_hardware_evidence": "platform/de1soc/qsys/system.sopcinfo",
    "board_connectivity_complete": false
  },
  "evidence_policy": {
    "source_checker": "scripts/check_csr_adapter.py",
    "human_document": "docs/architecture/avalon_mm_csr_adapter.md",
    "schema_file": "spec/schemas/avalon_csr_adapter.schema.json",
    "compile_evidence_present": false,
    "platform_designer_generation_evidence_present": false,
    "functional_verification_present": false,
    "hardware_evidence_present": false
  },
  "validation_rules": [
    "Decode all 21 byte-address bits before forwarding the lower 12 bits to the CSR leaf.",
    "Accept only aligned, full-width, little-endian, single-beat 32-bit transfers.",
    "Never issue a CSR leaf request for an out-of-window or malformed Avalon request.",
    "Permit at most one outstanding transaction and emit exactly one response for it.",
    "Return DECODEERROR for an address outside the 4 KiB window and SLVERR for malformed or leaf-rejected accesses.",
    "Return zero read data with every error response.",
    "Use one read response for an illegal simultaneous read/write assertion: SLVERR in-window, or DECODEERROR when the address is also outside the window.",
    "Count local_reject_pulse_o only for requests rejected before the CSR leaf.",
    "Count adapter-local rejects through a dedicated CSR-bank input so concurrent external rejects do not coalesce them.",
    "Do not claim board connectivity complete until generated HDL, SOPCINFO, Quartus compile, and hardware evidence exist.",
    "Functional verification is intentionally deferred beyond Step 6."
  ]
}
